E-Liquid,,,,,,,
Hawaiian Pog,E-Liquids > Naked 100,9.99,3mg,3x10ml,"Hawaiian POG by Naked 100 brings the tropics right to your taste buds, presenting a smooth, refreshing and delicious blend of freshly squeezed Orange juice, Passion Fruit's delightfully sweet and tart nectar, and exotically fruity and creamy Guava. Delicious down to the very last drop, Hawaiian POG is truly the year round vape for those looking for a perfectly balanced flavor.",70/30,http://www.vaporized.co.uk/wp-content/uploads/2017/07/IMG_4325-1-460x460.png
Brain Freeze,E-Liquids > Naked 100,9.99,3mg,3x10ml,"Brain Freeze by Naked 100 is refreshing on a whole new level, featuring perfectly ripe Strawberries and crisp Kiwi, backed with subtle yet complex Ruby Red Pomegranate essence, all served ice cold.",70/30,http://www.vaporized.co.uk/wp-content/uploads/2017/07/IMG_4305-460x460.png
Amazing Mango,E-Liquids > Naked 100,9.99,3mg,3x10ml,"Amazing Mango by Naked 100 takes a mango, peach, and cream smoothie and translates it into portable form, with a refreshing, sweet, and creamy profile perfect as an all day vape.",70/30,http://www.vaporized.co.uk/wp-content/uploads/2017/07/IMG_4313-1-460x460.png
Frost Bite,E-Liquids > Naked 100,9.99,3mg,3x10ml,"Frost Bite by Naked 100 is the perfect tropical refreshment, taking sweet and tart Pineapple, rich Cantaloupe, and smooth Honeydew slices, blending them into an ultra satisfying fruity frozen concoction.",70/30,http://www.vaporized.co.uk/wp-content/uploads/2017/07/IMG_4307-460x460.png
Lava Flow,E-Liquids > Naked 100,9.99,3mg,3x10ml,"Lava Flow by Naked 100 provides an escape to that tropical island on your screens background within two puffs. This delicious tropical flavor combination of fresh strawberries, with coconut, and pineapple intoxicate the senses and seduce the taste buds. Naked 100 E-Liquid is not responsible for any limbo dancing that ensues, or the desire to run your toes through sand.",70/30,http://www.vaporized.co.uk/wp-content/uploads/2017/07/IMG_4314-1-460x460.png
All Melon,E-Liquids > Naked 100,9.99,3mg,3x10ml,"All Melon by Naked 100 is the fusion of the three most delicious melons known to mankind. Start with an inhale of mouthwatering Watermelon tempered with rich, sweet Cantaloupe that finally ends with the ripe and bright Honeydew, this is an exquisite combination that leaves all other melon flavors far, far behind.",70/30,http://www.vaporized.co.uk/wp-content/uploads/2017/07/IMG_4311-460x460.png
Very Cool,E-Liquids > Naked 100,9.99,3mg,3x10ml,"Very Cool by Naked 100 takes freshly picked Blueberries, Blackberries, and Raspberries, flash freezes them, blend them, and drizzle a little bit of honey on top. Very Cool is as amazing as it sounds, with a sweet and tangy profile layered with refreshing notes of ice.",70/30,http://www.vaporized.co.uk/wp-content/uploads/2017/07/IMG_4302-460x460.png
Very Berry,E-Liquids > Naked 100,9.99,3mg,3x10ml,"Very Berry by Naked 100 is not your typical berry flavor, presenting an explosion of sweet, freshly picked Blueberries bursting with flavor combined with the rich complexity of Blackberries, finished off with a Lemon sugar drizzle. Sweet with a subtle hint of tartness, each inhale of Very Berry will keep your taste buds asking for more.",70/30,http://www.vaporized.co.uk/wp-content/uploads/2017/07/IMG_4323-1-460x460.png